logo byond bsi muncul banyak kali sila lanjut	train
sejak bsi mobile ganti byond hampir tiap hari asa lambat sering alami kendala mulai transaksi laku hingga tiba tiba error untung mybca bagai alternatif byond sedang lambat	train
byond bsi lambat	train
hanya byond bsi alami error	train
bagai solusi alternatif ini dapat kartu atm bsi net banking sudah aktif transaksi apabila byond bsi aktif	train
admin tepuk meja verifikasi wajah byond selalu gagal salah wajah coba kali kali tetap bsi mobile bisa akses ingin laku top butuh dana kecewa	train
sila byond bsi	train
assalamualaikum kak melissa mohon maaf atas ketidaknyamanan informasi bsi mobile sedang masa transisi beberapa fitur bsi mobile batas kendala aktivasi byond bsi alami dapat hubung lalu kontak sedia	val
assalamualaikum kak melissa mohon maaf atas ketidaknyamanan informasi bsi mobile ini dapat dan sedang masa transisi beberapa fitur bsi mobile batas nyaman transaksi dapat laku aktivasi byond bsi	test
